{
  "id": "redmi-a2",
  "brand": "Redmi",
  "model": "*",
  "marketing_name": "Redmi A2+",
  "codename": "water",
  "android": [
    "13"
  ],
  "fingerprint_regex": "^Redmi/water_global/water:",
  "auto_apply": false,
  "verification": "documented",
  "sources": [
    {
      "title": "Android Dumps: Android-Dumps/redmi/water",
      "url": "https://gitlab.com/Android-Dumps/redmi/water",
      "retrieved": "2026-10-30",
      "note": "Firmware dump for Redmi A2+"
    },
    {
      "title": "Dump README (build metadata)",
      "url": "https://gitlab.com/Android-Dumps/redmi/water/-/raw/missi-user-13-TP1A.220624.014-V14.0.11.0.TGOMIXM-release-keys/README.md",
      "retrieved": "2026-10-30",
      "note": "Codename, build id and fingerprint"
    },
    {
      "title": "Dump all_files.txt (APK and permission inventory)",
      "url": "https://gitlab.com/Android-Dumps/redmi/water/-/raw/missi-user-13-TP1A.220624.014-V14.0.11.0.TGOMIXM-release-keys/all_files.txt",
      "retrieved": "2026-10-30",
      "note": "Evidence that each package path exists in the firmware"
    }
  ],
  "tested": [],
  "disable": [],
  "ask": [
    {
      "package": "com.android.bips",
      "why": "Built-in print service",
      "breaks": "Printing"
    },
    {
      "package": "com.android.camera",
      "why": "AOSP Camera",
      "breaks": "Camera app"
    },
    {
      "package": "com.android.contacts",
      "why": "AOSP Contacts",
      "breaks": "Contacts app"
    },
    {
      "package": "com.android.deskclock",
      "why": "AOSP Clock",
      "breaks": "Alarms and timers"
    },
    {
      "package": "com.android.dialer",
      "why": "AOSP Phone",
      "breaks": "Calls if default; role guard blocks"
    },
    {
      "package": "com.android.mms",
      "why": "AOSP Messages",
      "breaks": "SMS if default; role guard blocks"
    },
    {
      "package": "com.android.music",
      "why": "AOSP Music",
      "breaks": "Music player"
    },
    {
      "package": "com.android.musicfx",
      "why": "MusicFX",
      "breaks": "Audio effects"
    },
    {
      "package": "com.android.quicksearchbox",
      "why": "Quick Search",
      "breaks": "Quick search"
    },
    {
      "package": "com.android.soundrecorder",
      "why": "AOSP Recorder",
      "breaks": "Voice recorder"
    },
    {
      "package": "com.android.wallpaper.livepicker",
      "why": "Live Wallpaper picker",
      "breaks": "Live wallpapers"
    },
    {
      "package": "com.google.android.apps.assistant",
      "why": "Google Assistant",
      "breaks": "Assistant"
    },
    {
      "package": "com.google.android.apps.messaging",
      "why": "Google Messages",
      "breaks": "SMS/RCS if default; role guard blocks"
    },
    {
      "package": "com.google.android.apps.nbu.files",
      "why": "Files by Google",
      "breaks": "Files app"
    },
    {
      "package": "com.google.android.apps.photos",
      "why": "Google Photos preload",
      "breaks": "Photos backup and gallery"
    },
    {
      "package": "com.google.android.apps.safetyhub",
      "why": "Personal Safety",
      "breaks": "Emergency sharing"
    },
    {
      "package": "com.google.android.apps.tachyon",
      "why": "Google Meet",
      "breaks": "Meet calls"
    },
    {
      "package": "com.google.android.apps.turbo",
      "why": "Adaptive Battery / Device Health",
      "breaks": "Adaptive Battery and diagnostics"
    },
    {
      "package": "com.google.android.apps.wellbeing",
      "why": "Digital Wellbeing",
      "breaks": "Screen-time reports and app timers"
    },
    {
      "package": "com.google.android.calendar",
      "why": "Google Calendar",
      "breaks": "Calendar and reminders"
    },
    {
      "package": "com.google.android.contacts",
      "why": "Google Contacts",
      "breaks": "Contacts app"
    },
    {
      "package": "com.google.android.dialer",
      "why": "Google Phone",
      "breaks": "Calls if default; role guard blocks"
    },
    {
      "package": "com.google.android.googlequicksearchbox",
      "why": "Google app / Assistant",
      "breaks": "Google app and Assistant"
    },
    {
      "package": "com.google.android.inputmethod.latin",
      "why": "Gboard",
      "breaks": "Keyboard if default; role guard blocks"
    },
    {
      "package": "com.google.android.projection.gearhead",
      "why": "Android Auto",
      "breaks": "Android Auto"
    },
    {
      "package": "com.mediatek.systemupdate",
      "why": "MediaTek system update",
      "breaks": "System update UI"
    },
    {
      "package": "com.miui.player",
      "why": "Mi Music",
      "breaks": "Mi Music player"
    }
  ],
  "never": [
    {
      "package": "android",
      "why": "Android framework"
    },
    {
      "package": "com.android.bluetooth",
      "why": "Bluetooth: earbuds, car, wearables"
    },
    {
      "package": "com.android.cellbroadcastreceiver",
      "why": "Emergency alerts"
    },
    {
      "package": "com.android.documentsui",
      "why": "System file picker"
    },
    {
      "package": "com.android.emergency",
      "why": "Emergency information and dialer"
    },
    {
      "package": "com.android.incallui",
      "why": "In-call UI"
    },
    {
      "package": "com.android.launcher3",
      "why": "System launcher"
    },
    {
      "package": "com.android.mms.service",
      "why": "MMS service"
    },
    {
      "package": "com.android.nfc",
      "why": "NFC payments and tags"
    },
    {
      "package": "com.android.packageinstaller",
      "why": "Package installer"
    },
    {
      "package": "com.android.permissioncontroller",
      "why": "Permission controller"
    },
    {
      "package": "com.android.phone",
      "why": "Telephony: calls, mobile data, SIM"
    },
    {
      "package": "com.android.providers.contacts",
      "why": "Contacts provider"
    },
    {
      "package": "com.android.providers.partnerbookmarks",
      "why": "Preloaded partner bookmarks"
    },
    {
      "package": "com.android.providers.telephony",
      "why": "SMS/APN provider"
    },
    {
      "package": "com.android.server.telecom",
      "why": "Call routing"
    },
    {
      "package": "com.android.settings",
      "why": "Android Settings"
    },
    {
      "package": "com.android.shell",
      "why": "ADB shell"
    },
    {
      "package": "com.android.stk",
      "why": "SIM Toolkit"
    },
    {
      "package": "com.android.systemui",
      "why": "Status bar, notifications, lock screen"
    },
    {
      "package": "com.android.vending",
      "why": "Play Store"
    },
    {
      "package": "com.android.vpndialogs",
      "why": "VPN consent"
    },
    {
      "package": "com.google.android.euicc",
      "why": "eSIM"
    },
    {
      "package": "com.google.android.gms",
      "why": "Play Services: push, banking, backups"
    },
    {
      "package": "com.google.android.gsf",
      "why": "Google Services Framework"
    },
    {
      "package": "com.google.android.ims",
      "why": "VoLTE, Wi-Fi calling and RCS"
    },
    {
      "package": "com.google.android.packageinstaller",
      "why": "Package installer"
    },
    {
      "package": "com.google.android.permissioncontroller",
      "why": "Permission controller"
    },
    {
      "package": "com.google.android.webview",
      "why": "WebView for in-app browsers"
    },
    {
      "package": "com.mediatek.bluetooth",
      "why": "Bluetooth stack"
    },
    {
      "package": "com.mediatek.cellbroadcastreceiver",
      "why": "Emergency alerts"
    },
    {
      "package": "com.mediatek.ims",
      "why": "IMS: VoLTE and Wi-Fi calling"
    },
    {
      "package": "com.mediatek.ims.config",
      "why": "IMS configuration"
    },
    {
      "package": "com.mediatek.ims.pco",
      "why": "IMS PCO"
    },
    {
      "package": "com.mediatek.ims.rcsua.service",
      "why": "IMS/RCS service"
    },
    {
      "package": "com.mediatek.op08.ims",
      "why": "IMS"
    },
    {
      "package": "com.mediatek.simprocessor",
      "why": "SIM processing"
    },
    {
      "package": "com.mediatek.telephony",
      "why": "MediaTek telephony"
    },
    {
      "package": "com.mediatek.wfo.impl",
      "why": "Wi-Fi calling"
    }
  ],
  "notes": "Documented from the water firmware dump (Android 13), not tested on a physical phone. Redmi package lists and preloads vary by region and carrier. Regional model numbers vary; the profile is pinned by fingerprint and codename. No auto-apply; ask before every package."
}
