{
  "id": "oneplus-ac2003",
  "brand": "OnePlus",
  "model": "AC2003",
  "marketing_name": "OnePlus Nord",
  "codename": "Nord",
  "android": [
    "11"
  ],
  "fingerprint_regex": "^OnePlus/Nord/Nord:11/",
  "auto_apply": false,
  "verification": "documented",
  "sources": [
    {
      "title": "Android Dumps: oneplus/Nord",
      "url": "https://gitlab.com/Android-Dumps/oneplus/Nord",
      "retrieved": "2026-10-29",
      "note": "Firmware dump for OnePlus Nord"
    },
    {
      "title": "Dump README (build metadata)",
      "url": "https://gitlab.com/Android-Dumps/oneplus/Nord/-/raw/qssi-user-11-RP1A.201005.001-2203101721-release-keys/README.md",
      "retrieved": "2026-10-29",
      "note": "Codename, build id and fingerprint"
    },
    {
      "title": "Dump all_files.txt (APK and permission inventory)",
      "url": "https://gitlab.com/Android-Dumps/oneplus/Nord/-/raw/qssi-user-11-RP1A.201005.001-2203101721-release-keys/all_files.txt",
      "retrieved": "2026-10-29",
      "note": "Evidence that each package path exists in the firmware"
    }
  ],
  "tested": [],
  "disable": [],
  "ask": [
    {
      "package": "com.facebook.appmanager",
      "why": "Facebook app manager preload",
      "breaks": "Facebook app management"
    },
    {
      "package": "com.facebook.services",
      "why": "Facebook services preload",
      "breaks": "Facebook background services"
    },
    {
      "package": "com.facebook.system",
      "why": "Facebook system preload",
      "breaks": "Facebook system components"
    },
    {
      "package": "com.google.android.apps.messaging",
      "why": "Google Messages",
      "breaks": "SMS/RCS if default; role guard blocks"
    },
    {
      "package": "com.google.android.apps.nbu.files",
      "why": "Files by Google",
      "breaks": "Files app"
    },
    {
      "package": "com.google.android.apps.photos",
      "why": "Google Photos preload",
      "breaks": "Photos backup and gallery"
    },
    {
      "package": "com.google.android.apps.tachyon",
      "why": "Google Meet",
      "breaks": "Meet calls"
    },
    {
      "package": "com.google.android.apps.turbo",
      "why": "Adaptive Battery / Device Health",
      "breaks": "Adaptive Battery and diagnostics"
    },
    {
      "package": "com.google.android.apps.wellbeing",
      "why": "Digital Wellbeing",
      "breaks": "Screen-time reports and app timers"
    },
    {
      "package": "com.google.android.calendar",
      "why": "Google Calendar",
      "breaks": "Calendar and reminders"
    },
    {
      "package": "com.google.android.contacts",
      "why": "Google Contacts",
      "breaks": "Contacts app"
    },
    {
      "package": "com.google.android.dialer",
      "why": "Google Phone",
      "breaks": "Calls if default; role guard blocks"
    },
    {
      "package": "com.google.android.feedback",
      "why": "Google feedback",
      "breaks": "Nothing user-facing"
    },
    {
      "package": "com.google.android.googlequicksearchbox",
      "why": "Google app / Assistant",
      "breaks": "Google app and Assistant"
    },
    {
      "package": "com.google.android.inputmethod.latin",
      "why": "Gboard",
      "breaks": "Keyboard if default; role guard blocks"
    },
    {
      "package": "com.google.android.projection.gearhead",
      "why": "Android Auto",
      "breaks": "Android Auto"
    },
    {
      "package": "com.oneplus.aod",
      "why": "OnePlus Always On Display",
      "breaks": "Always On Display"
    },
    {
      "package": "com.oneplus.camera",
      "why": "OnePlus Camera",
      "breaks": "Camera app"
    },
    {
      "package": "com.oneplus.deskclock",
      "why": "OnePlus Clock",
      "breaks": "Alarms and timers"
    },
    {
      "package": "com.oneplus.gallery",
      "why": "OnePlus Gallery",
      "breaks": "Gallery app and editing"
    },
    {
      "package": "net.oneplus.odm",
      "why": "OnePlus Device Manager",
      "breaks": "Device management and telemetry"
    }
  ],
  "never": [
    {
      "package": "android",
      "why": "Android framework"
    },
    {
      "package": "com.android.systemui",
      "why": "Status bar, notifications, lock screen"
    },
    {
      "package": "com.android.settings",
      "why": "Android Settings"
    },
    {
      "package": "com.android.shell",
      "why": "ADB shell"
    },
    {
      "package": "com.android.phone",
      "why": "Telephony: calls, mobile data, SIM"
    },
    {
      "package": "com.android.server.telecom",
      "why": "Call routing"
    },
    {
      "package": "com.android.incallui",
      "why": "In-call UI"
    },
    {
      "package": "com.android.providers.telephony",
      "why": "SMS/APN provider"
    },
    {
      "package": "com.android.permissioncontroller",
      "why": "Permission controller"
    },
    {
      "package": "com.android.packageinstaller",
      "why": "Package installer"
    },
    {
      "package": "com.google.android.gms",
      "why": "Play Services: push, banking, backups"
    },
    {
      "package": "com.google.android.gsf",
      "why": "Google Services Framework"
    },
    {
      "package": "com.android.vending",
      "why": "Play Store"
    },
    {
      "package": "com.google.android.webview",
      "why": "WebView for in-app browsers"
    },
    {
      "package": "com.google.android.networkstack",
      "why": "Network stack"
    },
    {
      "package": "com.android.cellbroadcastreceiver",
      "why": "Emergency alerts"
    },
    {
      "package": "com.google.android.ims",
      "why": "VoLTE, Wi-Fi calling and RCS"
    },
    {
      "package": "com.android.carrierconfig",
      "why": "Carrier configuration"
    },
    {
      "package": "com.android.nfc",
      "why": "NFC payments and tags"
    },
    {
      "package": "com.android.bluetooth",
      "why": "Bluetooth: earbuds, car, wearables"
    },
    {
      "package": "com.android.documentsui",
      "why": "System file picker"
    },
    {
      "package": "com.android.vpndialogs",
      "why": "VPN consent"
    },
    {
      "package": "com.android.emergency",
      "why": "Emergency information and dialer"
    },
    {
      "package": "net.oneplus.launcher",
      "why": "System launcher and Recents"
    },
    {
      "package": "com.android.launcher3",
      "why": "System launcher"
    },
    {
      "package": "org.codeaurora.ims",
      "why": "IMS: VoLTE and Wi-Fi calling"
    },
    {
      "package": "com.qualcomm.qcrilmsgtunnel",
      "why": "Qualcomm telephony"
    },
    {
      "package": "com.quicinc.cne.CNEService",
      "why": "Connectivity engine"
    }
  ],
  "notes": "Documented from the Nord firmware dump (Android 11), not tested on a physical phone. The OnePlus 6T profile is the device-tested OnePlus profile. No auto-apply; ask before every package. Region and carrier variants may differ."
}
