{
  "id": "poco-f3",
  "brand": "POCO",
  "model": "M2012K11AG",
  "marketing_name": "POCO F3",
  "codename": "alioth",
  "android": [
    "12"
  ],
  "fingerprint_regex": "^Redmi/alioth/alioth:",
  "auto_apply": false,
  "verification": "documented",
  "sources": [
    {
      "title": "Android Dumps: Android-Dumps/poco/alioth",
      "url": "https://gitlab.com/Android-Dumps/poco/alioth",
      "retrieved": "2026-10-30",
      "note": "Firmware dump for POCO F3"
    },
    {
      "title": "Dump README (build metadata)",
      "url": "https://gitlab.com/Android-Dumps/poco/alioth/-/raw/22.6.22/README.md",
      "retrieved": "2026-10-30",
      "note": "Codename, build id and fingerprint"
    },
    {
      "title": "Dump all_files.txt (APK and permission inventory)",
      "url": "https://gitlab.com/Android-Dumps/poco/alioth/-/raw/22.6.22/all_files.txt",
      "retrieved": "2026-10-30",
      "note": "Evidence that each package path exists in the firmware"
    }
  ],
  "tested": [],
  "disable": [],
  "ask": [
    {
      "package": "com.android.bips",
      "why": "Built-in print service",
      "breaks": "Printing"
    },
    {
      "package": "com.android.camera",
      "why": "AOSP Camera",
      "breaks": "Camera app"
    },
    {
      "package": "com.android.contacts",
      "why": "AOSP Contacts",
      "breaks": "Contacts app"
    },
    {
      "package": "com.android.deskclock",
      "why": "AOSP Clock",
      "breaks": "Alarms and timers"
    },
    {
      "package": "com.android.mms",
      "why": "AOSP Messages",
      "breaks": "SMS if default; role guard blocks"
    },
    {
      "package": "com.android.musicfx",
      "why": "MusicFX",
      "breaks": "Audio effects"
    },
    {
      "package": "com.android.quicksearchbox",
      "why": "Quick Search",
      "breaks": "Quick search"
    },
    {
      "package": "com.android.soundrecorder",
      "why": "AOSP Recorder",
      "breaks": "Voice recorder"
    },
    {
      "package": "com.google.android.apps.nbu.files",
      "why": "Files by Google",
      "breaks": "Files app"
    },
    {
      "package": "com.google.android.apps.tachyon",
      "why": "Google Meet",
      "breaks": "Meet calls"
    },
    {
      "package": "com.google.android.apps.turbo",
      "why": "Adaptive Battery / Device Health",
      "breaks": "Adaptive Battery and diagnostics"
    },
    {
      "package": "com.google.android.calendar",
      "why": "Google Calendar",
      "breaks": "Calendar and reminders"
    },
    {
      "package": "com.google.android.contacts",
      "why": "Google Contacts",
      "breaks": "Contacts app"
    },
    {
      "package": "com.google.android.googlequicksearchbox",
      "why": "Google app / Assistant",
      "breaks": "Google app and Assistant"
    },
    {
      "package": "com.google.android.projection.gearhead",
      "why": "Android Auto",
      "breaks": "Android Auto"
    },
    {
      "package": "com.miui.aod",
      "why": "Always On Display",
      "breaks": "Always On Display"
    },
    {
      "package": "com.miui.backup",
      "why": "Mi Backup",
      "breaks": "Local backup"
    },
    {
      "package": "com.miui.cleaner",
      "why": "Mi Cleaner preload",
      "breaks": "Cleaner app and its shortcuts"
    },
    {
      "package": "com.miui.cleanmaster",
      "why": "Clean Master preload",
      "breaks": "Cleaner/booster features"
    },
    {
      "package": "com.miui.cloudbackup",
      "why": "Mi Cloud backup",
      "breaks": "Mi Cloud backup/restore"
    },
    {
      "package": "com.miui.dmregservice",
      "why": "Mi device management",
      "breaks": "Device management/telemetry"
    },
    {
      "package": "com.miui.extraphoto",
      "why": "Extra photo features",
      "breaks": "Some gallery/camera effects"
    },
    {
      "package": "com.miui.freeform",
      "why": "Freeform windows",
      "breaks": "Freeform window mode"
    },
    {
      "package": "com.miui.gallery",
      "why": "Mi Gallery",
      "breaks": "Gallery app"
    },
    {
      "package": "com.miui.huanji",
      "why": "Mi Mover",
      "breaks": "Phone-to-phone migration"
    },
    {
      "package": "com.miui.miservice",
      "why": "Services & feedback",
      "breaks": "Feedback and service shortcuts"
    },
    {
      "package": "com.miui.mishare.connectivity",
      "why": "Mi Share",
      "breaks": "Mi Share file transfer"
    },
    {
      "package": "com.miui.player",
      "why": "Mi Music",
      "breaks": "Mi Music player"
    },
    {
      "package": "com.miui.weather2",
      "why": "Mi Weather",
      "breaks": "Weather app and widget"
    },
    {
      "package": "com.xiaomi.finddevice",
      "why": "Find Device",
      "breaks": "Remote locate/lock"
    },
    {
      "package": "com.xiaomi.mirror",
      "why": "Screen mirroring",
      "breaks": "Screen mirroring"
    },
    {
      "package": "com.xiaomi.misettings",
      "why": "Mi Settings",
      "breaks": "Some Mi settings screens"
    },
    {
      "package": "com.xiaomi.uatalive",
      "why": "Xiaomi usage/telemetry",
      "breaks": "Usage analytics"
    }
  ],
  "never": [
    {
      "package": "android",
      "why": "Android framework"
    },
    {
      "package": "com.android.bluetooth",
      "why": "Bluetooth: earbuds, car, wearables"
    },
    {
      "package": "com.android.cellbroadcastreceiver",
      "why": "Emergency alerts"
    },
    {
      "package": "com.android.documentsui",
      "why": "System file picker"
    },
    {
      "package": "com.android.emergency",
      "why": "Emergency information and dialer"
    },
    {
      "package": "com.android.incallui",
      "why": "In-call UI"
    },
    {
      "package": "com.android.launcher3",
      "why": "System launcher"
    },
    {
      "package": "com.android.mms.service",
      "why": "MMS service"
    },
    {
      "package": "com.android.nfc",
      "why": "NFC payments and tags"
    },
    {
      "package": "com.android.packageinstaller",
      "why": "Package installer"
    },
    {
      "package": "com.android.permissioncontroller",
      "why": "Permission controller"
    },
    {
      "package": "com.android.phone",
      "why": "Telephony: calls, mobile data, SIM"
    },
    {
      "package": "com.android.providers.contacts",
      "why": "Contacts provider"
    },
    {
      "package": "com.android.providers.telephony",
      "why": "SMS/APN provider"
    },
    {
      "package": "com.android.server.telecom",
      "why": "Call routing"
    },
    {
      "package": "com.android.settings",
      "why": "Android Settings"
    },
    {
      "package": "com.android.shell",
      "why": "ADB shell"
    },
    {
      "package": "com.android.systemui",
      "why": "Status bar, notifications, lock screen"
    },
    {
      "package": "com.android.vending",
      "why": "Play Store"
    },
    {
      "package": "com.android.vpndialogs",
      "why": "VPN consent"
    },
    {
      "package": "com.google.android.documentsui",
      "why": "System file picker"
    },
    {
      "package": "com.google.android.gms",
      "why": "Play Services: push, banking, backups"
    },
    {
      "package": "com.google.android.gsf",
      "why": "Google Services Framework"
    },
    {
      "package": "com.google.android.packageinstaller",
      "why": "Package installer"
    },
    {
      "package": "com.google.android.permissioncontroller",
      "why": "Permission controller"
    },
    {
      "package": "com.google.android.webview",
      "why": "WebView for in-app browsers"
    },
    {
      "package": "com.mi.android.globallauncher",
      "why": "System launcher"
    },
    {
      "package": "com.miui.euicc",
      "why": "eSIM"
    },
    {
      "package": "com.miui.home",
      "why": "System launcher"
    },
    {
      "package": "com.miui.securitycenter",
      "why": "Security app: permissions, privacy, battery"
    },
    {
      "package": "com.qualcomm.qcrilmsgtunnel",
      "why": "Qualcomm telephony"
    },
    {
      "package": "com.quicinc.cne.CNEService",
      "why": "Connectivity engine"
    },
    {
      "package": "org.codeaurora.ims",
      "why": "IMS: VoLTE and Wi-Fi calling"
    }
  ],
  "notes": "Documented from the alioth firmware dump (Android 12), not tested on a physical phone. POCO package lists and preloads vary by region and carrier. No auto-apply; ask before every package."
}
